{
  "$schema": "https://json-schema.org/draft/2020-12/schema",
  "title": "Turnkey client config",
  "description": "Keys match Delivery's CLIENT-QUESTIONNAIRE-TEMPLATE.md exactly (18 + 4 added: brand.photos, forms.destination, forms.turnstileSiteKey, site.size). x-proposed keys are not yet in the questionnaire.",
  "type": "object",
  "required": [
    "business",
    "contact",
    "location",
    "hours",
    "site",
    "brand",
    "services",
    "features",
    "owner",
    "payment",
    "preview",
    "feedback",
    "forms"
  ],
  "properties": {
    "business": {
      "type": "object",
      "required": [
        "name",
        "owner",
        "trade"
      ],
      "properties": {
        "name": {
          "type": "string",
          "minLength": 2,
          "maxLength": 80,
          "x-q": 1
        },
        "owner": {
          "type": "string",
          "minLength": 2,
          "maxLength": 80,
          "x-q": 2
        },
        "trade": {
          "type": "string",
          "minLength": 2,
          "maxLength": 60,
          "x-q": 3
        },
        "licenseInsured": {
          "type": "string",
          "maxLength": 120,
          "x-proposed": true
        }
      }
    },
    "contact": {
      "type": "object",
      "required": [
        "phone",
        "email"
      ],
      "properties": {
        "phone": {
          "type": "string",
          "pattern": "^\\(\\d{3}\\) \\d{3}-\\d{4}$",
          "x-q": 4
        },
        "email": {
          "type": "string",
          "format": "email",
          "maxLength": 120,
          "x-q": 5
        }
      }
    },
    "location": {
      "type": "object",
      "required": [
        "serviceArea"
      ],
      "properties": {
        "mapAddress": {
          "type": "string",
          "maxLength": 160,
          "x-q": 6,
          "description": "Optional; blank = service-area-only, no map."
        },
        "serviceArea": {
          "type": "string",
          "minLength": 2,
          "maxLength": 300,
          "x-q": 7
        }
      }
    },
    "hours": {
      "type": "string",
      "minLength": 2,
      "maxLength": 120,
      "x-q": 8
    },
    "site": {
      "type": "object",
      "required": [
        "domain",
        "size"
      ],
      "properties": {
        "domain": {
          "type": "string",
          "maxLength": 100,
          "x-q": 9
        },
        "size": {
          "type": "string",
          "enum": [
            "one-page",
            "multi-page"
          ],
          "x-q": 22
        }
      }
    },
    "brand": {
      "type": "object",
      "required": [
        "logo"
      ],
      "properties": {
        "logo": {
          "type": "string",
          "maxLength": 200,
          "x-q": 10,
          "description": "Filename inside --assets (or N)."
        },
        "photos": {
          "type": "array",
          "items": {
            "type": "string",
            "maxLength": 200
          },
          "maxItems": 24,
          "x-q": 19
        },
        "tagline": {
          "type": "string",
          "maxLength": 140,
          "x-proposed": true
        },
        "primaryColor": {
          "type": "string",
          "pattern": "^#[0-9a-fA-F]{6}$",
          "x-proposed": true
        }
      }
    },
    "services": {
      "type": "array",
      "minItems": 1,
      "maxItems": 30,
      "items": {
        "type": "string",
        "minLength": 2,
        "maxLength": 80
      },
      "x-q": 11
    },
    "features": {
      "type": "object",
      "required": [
        "chat"
      ],
      "properties": {
        "chat": {
          "type": "boolean",
          "x-q": 12
        }
      }
    },
    "owner": {
      "type": "object",
      "required": [
        "loginEmail"
      ],
      "properties": {
        "loginEmail": {
          "type": "string",
          "format": "email",
          "maxLength": 120,
          "x-q": 13
        }
      }
    },
    "payment": {
      "type": "object",
      "required": [
        "link"
      ],
      "properties": {
        "link": {
          "type": "string",
          "maxLength": 200,
          "x-q": 14,
          "description": "https Stripe Payment Link or a public Zelle handle; blank = 'Payment link pending'."
        }
      }
    },
    "preview": {
      "type": "object",
      "properties": {
        "url": {
          "type": "string",
          "maxLength": 200,
          "x-q": 15
        }
      }
    },
    "feedback": {
      "type": "object",
      "properties": {
        "approved": {
          "type": [
            "boolean",
            "string"
          ],
          "x-q": 16
        },
        "changes": {
          "type": "string",
          "maxLength": 2000,
          "x-q": 17
        },
        "missing": {
          "type": "string",
          "maxLength": 2000,
          "x-q": 18
        }
      }
    },
    "forms": {
      "type": "object",
      "properties": {
        "destination": {
          "type": "string",
          "enum": [
            "owner-dashboard",
            "owner-dashboard+email"
          ],
          "x-q": 20
        },
        "turnstileSiteKey": {
          "type": "string",
          "pattern": "^[0-9a-zA-Z_-]{10,64}$",
          "description": "Set by TTA, not the client.",
          "x-q": 21
        }
      },
      "required": [
        "destination",
        "turnstileSiteKey"
      ]
    }
  }
}